{
  "schema_version": "0.2",
  "id": "a1b2c3d4-e5f6-7890-abcd-ef1234567890",
  "name": "invoice-note-parser",
  "experiment_phase": "phase_0_spec",
  "created_at": "2026-06-19T10:00:00Z",
  "updated_at": "2026-06-19T12:00:00Z",
  "status": "designing",
  "current_step": "fab-spec",
  "current_app_stage": null,
  "next_action": "/fab-plan",
  "last_error": null,
  "spec_path": "docs/spec.md",
  "blueprint_path": null,
  "app_stages": [],
  "costs": {
    "precision": "unknown",
    "tokens_in": "unknown",
    "tokens_out": "unknown",
    "api_calls": "unknown",
    "estimated_usd": "unknown",
    "budget_usd": null,
    "by_step": {}
  },
  "verifications": [],
  "human_decisions": [
    {
      "step": "fab-spec",
      "decision_needed": "Approve the spec before it is written to docs/spec.md",
      "options": ["approve", "revise", "reject"],
      "decision": "approve",
      "rationale": "Operator verdict typed in a local terminal via fabrica-skills approve.",
      "triggered_at": "2026-06-19T11:50:00Z",
      "resolved_at": "2026-06-19T11:55:00Z"
    }
  ],
  "gate_levels": {
    "fab-spec": "checkpoint",
    "fab-plan": "checkpoint",
    "fab-scaffold": "auto",
    "fab-build": "auto",
    "fab-eval": "auto",
    "fab-status": "auto",
    "fab-handoff": "auto",
    "fab-fix": "auto",
    "fab-integrate": "checkpoint",
    "fab-verify": "review",
    "fab-decide": "full",
    "fab-pr-review": "auto",
    "fab-retro": "auto",
    "fabrica-code-review": "auto",
    "fab-discover": "auto",
    "fab-adopt": "checkpoint"
  },
  "preferred_stack": {
    "frontend": null,
    "backend": null,
    "database": null
  }
}
